{
  "architecture_id": "sm_120a",
  "compiler_observations": [
    {
      "applicability": "GInfer retained Muse source 196873072461d218e0f2ba5cf4a7c7c0a7b2ebd0 at terminal report 4a3587a3fdb5d6ce8d3022b4de1eae15348d56e7; cross-build statements are compile evidence only",
      "build_revision": "196873072461d218e0f2ba5cf4a7c7c0a7b2ebd0",
      "claim": "The terminal Muse consolidation source passed the native sm_120a Release build and seven focused real-artifact and numerical tests; the unchanged retained source also completed fresh sm_86 and sm_89 Release cross-builds without selecting the sm_120a-only W8 route.",
      "fact_id": "sm120a-muse-consolidation-terminal-4a3587a3",
      "hardware_sku": null,
      "source_refs": [
        "ginfer-sm120a-rtx5090-muse-consolidation-terminal-report-4a3587a3"
      ],
      "toolchain": "CUDA 13.3.73",
      "workload_key": null
    }
  ],
  "device_measurements": [
    {
      "applicability": "that physical RTX 5090 campaign run only",
      "build_revision": "ac1cbf9cb72cbfe146a7e016e1c5dd80b45d2186",
      "claim": "On the campaign RTX 5090, retained Muse DFlash2 k4 C8 Program latency at 8K/request fell from 57.2176 to 42.0805 ms across the six accepted single-mechanism changes, a 26.46% reduction.",
      "fact_id": "sm120a-muse-c8-terminal-campaign",
      "hardware_sku": "NVIDIA GeForce RTX 5090",
      "source_refs": [
        "ginfer-sm120a-rtx5090-muse-campaign-report-99d1634d",
        "ginfer-sm120a-rtx5090-muse-campaign-ledger-99d1634d"
      ],
      "toolchain": "CUDA 13.3.73",
      "workload_key": "muse-dflash2-draft4-int8g64-c8-8k"
    },
    {
      "applicability": "that physical RTX 5090 consolidation run only",
      "build_revision": "196873072461d218e0f2ba5cf4a7c7c0a7b2ebd0",
      "claim": "On the campaign RTX 5090, the accepted consolidation package measured 41.5275 and 41.3232 ms against a conservative 42.3995 ms C8 control, improvements of 2.0566% and 2.5385%.",
      "fact_id": "sm120a-muse-c8-consolidation-cycle1",
      "hardware_sku": "NVIDIA GeForce RTX 5090",
      "source_refs": [
        "ginfer-sm120a-rtx5090-muse-consolidation-c1-report-e5036052",
        "ginfer-sm120a-rtx5090-muse-consolidation-c1-ledger-e5036052"
      ],
      "toolchain": "CUDA 13.3.73",
      "workload_key": "muse-dflash2-draft4-int8g64-c8-8k-consolidation"
    },
    {
      "applicability": "that physical RTX 5090 terminal confirmation only",
      "build_revision": "196873072461d218e0f2ba5cf4a7c7c0a7b2ebd0",
      "claim": "On the campaign RTX 5090, the unchanged retained package's terminal confirmation measured 41.0798 ms and 872.154 aggregate tok/s at C8/8K, plus 32.4739 ms at C1/129041; relative to consolidation start these are 3.1125% and 2.9384% latency improvements.",
      "fact_id": "sm120a-muse-consolidation-terminal-matrix",
      "hardware_sku": "NVIDIA GeForce RTX 5090",
      "source_refs": [
        "ginfer-sm120a-rtx5090-muse-consolidation-terminal-report-4a3587a3",
        "ginfer-sm120a-rtx5090-muse-consolidation-terminal-ledger-4a3587a3"
      ],
      "toolchain": "CUDA 13.3.73",
      "workload_key": "muse-dflash2-draft4-int8g64-terminal-matrix"
    }
  ],
  "fact_policy": "The architecture-specific suffix is retained explicitly. Compiler observations require an exact sm_120a toolchain/build; RTX 5090 and RTX PRO 6000 measurements remain separate.",
  "immutable_facts": [
    {
      "applicability": "compute capability 12.0 subject to the cited guide version",
      "build_revision": null,
      "claim": "For compute capability 12.0, the Blackwell tuning guide documents 48 maximum concurrent warps per SM, a 64K 32-bit register file per SM, and up to 32 thread blocks per SM; live occupancy still depends on kernel resources.",
      "fact_id": "sm120-blackwell-occupancy",
      "hardware_sku": null,
      "source_refs": [
        "nvidia-blackwell-tuning-guide-current-pdf",
        "nvidia-cuda-occupancy-api-current"
      ],
      "toolchain": null,
      "workload_key": null
    },
    {
      "applicability": "compute capability 12.0 subject to the cited guide version",
      "build_revision": null,
      "claim": "For compute capability 12.0, the Blackwell tuning guide documents 128 KB shared memory per SM and 99 KB maximum shared memory per thread block.",
      "fact_id": "sm120-blackwell-shared-memory",
      "hardware_sku": null,
      "source_refs": [
        "nvidia-blackwell-tuning-guide-current-pdf"
      ],
      "toolchain": null,
      "workload_key": null
    }
  ],
  "marketing_family": "Blackwell",
  "schema_version": "1.0.0"
}
